{
  "checkpointVersion": "0.1",
  "hashAlgorithm": "SHA-256",
  "canonicalization": "RFC8785",
  "chains": [
    {
      "chainId": "chain-platform-control-service-instance-7c1a",
      "head": {
        "sequence": 3,
        "hash": "6e066fd770f79d596f97f36dba3dd5be6348acd73d1ec21cc3dd899ec389d186"
      },
      "eventCount": 3
    },
    {
      "chainId": "chain-platform-control-service-instance-9e4b",
      "head": {
        "sequence": 3,
        "hash": "7d7461fef60b145239de6e0d43e6ae7cb18c5c4b002eac452a5efd91e5052d65"
      },
      "eventCount": 3
    }
  ],
  "createdAt": "2026-04-03T10:00:00Z",
  "anchor": {
    "type": "publication",
    "reference": "https://audit-archive.example/checkpoints/platform-control-service/2026-04-03",
    "recordedAt": "2026-04-03T10:00:05Z"
  },
  "description": "Both instance chains of platform-control-service at the close of change window change-10241.",
  "applications": ["platform-control-service"],
  "timeRange": {
    "from": "2026-04-03T08:00:12.500Z",
    "to": "2026-04-03T09:47:02.310Z"
  },
  "signature": {
    "algorithm": "Ed25519",
    "value": "PRsjZs01cKfmDiRpD+rSoeyAh/jDolg5LN+5CGkb/yasptCGVadpRjMwdIGL2snxJSY8OC+xUFuKBCOGgY52DQ==",
    "keyId": "example-fixture-key-2026"
  }
}
